ffff8800129c4e40 2140155288 S Co:3:029:0 s 41 00 0001 0000 0000 0
ffff8800129c4e40 2140155413 C Co:3:029:0 0 0
ffff8800129c4e40 2140155446 S Ci:3:029:0 s c1 1d 0000 0000 0004 4 <
ffff8800129c4e40 2140155573 C Ci:3:029:0 0 4 = 80250000
ffff8800129c4e40 2140155602 S Ci:3:029:0 s c1 04 0000 0000 0002 2 <
ffff8800129c4e40 2140155723 C Ci:3:029:0 0 2 = 0006
ffff8800129c4e40 2140155753 S Ci:3:029:0 s c1 14 0000 0000 0010 16 <
ffff8800129c4e40 2140155945 C Ci:3:029:0 0 16 = 00000000 00000000 00000000 00000000








ffff8800129c4e40 2140155981 S Co:3:029:0 s 41 1e 0000 0000 0004 4 = 80250000
ffff8800129c4e40 2140156304 C Co:3:029:0 0 4 >
ffff880036a1a0c0 2140156343 S Bi:3:029:1 -115 256 <
ffff880036a1a480 2140156348 S Bi:3:029:1 -115 256 <
ffff8800129c4e40 2140156351 S Co:3:029:0 s 41 07 0303 0000 0000 0
ffff8800129c4e40 2140156469 C Co:3:029:0 0 0
ffff880036a1a240 2140157499 S Bo:3:029:1 -115 256 = 726f6f74 3a783a30 3a303a72 6f6f743a 2f726f6f 743a2f75 73722f62 696e2f7a
ffff880036a1a300 2140157507 S Bo:3:029:1 -115 256 = 7661722f 63616368 652f6d61 6e3a2f75 73722f73 62696e2f 6e6f6c6f 67696e0a
ffff880036a1a240 2140158117 C Bo:3:029:1 0 256 >
ffff880036a1a240 2140158125 S Bo:3:029:1 -115 256 = 6e2f6e6f 6c6f6769 6e0a7777 772d6461 74613a78 3a33333a 33333a77 77772d64
ffff880036a1a300 2140158674 C Bo:3:029:1 0 256 >
ffff880036a1a300 2140158694 S Bo:3:029:1 -115 256 = 74696e67 20537973 74656d20 2861646d 696e293a 2f766172 2f6c6962 2f676e61
ffff880036a1a240 2140317480 C Bo:3:029:1 0 256 >
ffff880036a1a240 2140317489 S Bo:3:029:1 -115 256 = 393a3a2f 7661722f 6c69622f 6c616e64 73636170 653a2f62 696e2f66 616c7365
ffff880036a1a300 2140531474 C Bo:3:029:1 0 256 >
ffff880036a1a300 2140531483 S Bo:3:029:1 -115 256 = 3a2f6269 6e2f6661 6c73650a 72616e63 69643a78 3a313037 3a313135 3a3a2f76
ffff880036a1a240 2140744484 C Bo:3:029:1 0 256 >
ffff880036a1a240 2140744494 S Bo:3:029:1 -115 136 = 783a3130 30353a31 3030353a 3a2f686f 6d652f65 68326872 6e653a2f 7573722f
ffff880036a1a300 2140958481 C Bo:3:029:1 0 256 >
ffff880036a1a240 2141118443 C Bo:3:029:1 0 136 >
ffff8800d5afd3c0 2141118565 S Co:3:029:0 s 41 07 0300 0000 0000 0
ffff8800d5afd3c0 2141118696 C Co:3:029:0 0 0
ffff880036a1a0c0 2141118792 C Bi:3:029:1 -2 0
ffff880036a1a480 2141118862 C Bi:3:029:1 -2 0
ffff8800d5a38a80 2141118893 S Co:3:029:0 s 41 00 0000 0000 0000 0
ffff8800d5a38a80 2141119028 C Co:3:029:0 
